{"$schema":"https://json-schema.org/draft/2020-12/schema","$id":"https://toesa.local/schemas/ai-weekly-report-snapshot-v1.schema.json","title":"AI Weekly Report Snapshot v1","type":"object","properties":{"schemaVersion":{"const":"ai-weekly-report-snapshot.v1"},"reportContext":{"type":"object","properties":{"groupRef":{"type":"string","minLength":1},"period":{"type":"object","properties":{"from":{"type":"string","format":"date"},"toExclusive":{"type":"string","format":"date"},"timezone":{"type":"string","minLength":1}},"required":["from","toExclusive","timezone"],"additionalProperties":false},"generatedAt":{"type":"string","format":"date-time"},"language":{"enum":["KO","EN"]},"promptVersion":{"type":"string","minLength":1}},"required":["groupRef","period","generatedAt","language","promptVersion"],"additionalProperties":false},"metrics":{"type":"object","properties":{"periodTaskCount":{"type":"integer","minimum":0},"completionRatePercent":{"type":["integer","null"],"minimum":0,"maximum":100},"onTimeRatePercent":{"type":["integer","null"],"minimum":0,"maximum":100},"delayedCount":{"type":"integer","minimum":0},"averageCompletionHours":{"type":["integer","null"],"minimum":0}},"required":["periodTaskCount","completionRatePercent","onTimeRatePercent","delayedCount","averageCompletionHours"],"additionalProperties":false},"comparison":{"type":"object","properties":{"status":{"enum":["AVAILABLE","NO_BASELINE"]},"previousFrom":{"type":["string","null"],"format":"date"},"previousToExclusive":{"type":["string","null"],"format":"date"},"periodTaskCountDelta":{"type":["integer","null"]},"completionRatePointDelta":{"type":["integer","null"],"minimum":-100,"maximum":100},"onTimeRatePointDelta":{"type":["integer","null"],"minimum":-100,"maximum":100},"delayedCountDelta":{"type":["integer","null"]}},"required":["status","previousFrom","previousToExclusive","periodTaskCountDelta","completionRatePointDelta","onTimeRatePointDelta","delayedCountDelta"],"additionalProperties":false},"workflow":{"type":"object","properties":{"requested":{"type":"integer","minimum":0},"acceptedUnassigned":{"type":"integer","minimum":0},"assignedNotStarted":{"type":"integer","minimum":0},"inProgress":{"type":"integer","minimum":0},"onHold":{"type":"integer","minimum":0},"completed":{"type":"integer","minimum":0}},"required":["requested","acceptedUnassigned","assignedNotStarted","inProgress","onHold","completed"],"additionalProperties":false},"members":{"type":"array","maxItems":100,"items":{"type":"object","properties":{"memberRef":{"type":"string","minLength":1},"role":{"type":"string"},"assignedCount":{"type":"integer","minimum":0},"activeCount":{"type":"integer","minimum":0},"completedCount":{"type":"integer","minimum":0},"delayedCount":{"type":"integer","minimum":0},"onTimeRatePercent":{"type":["integer","null"],"minimum":0,"maximum":100},"upcomingCalendarCount":{"type":"integer","minimum":0}},"required":["memberRef","role","assignedCount","activeCount","completedCount","delayedCount","onTimeRatePercent","upcomingCalendarCount"],"additionalProperties":false}},"tasks":{"type":"array","maxItems":100,"items":{"type":"object","properties":{"taskRef":{"type":"string","minLength":1},"safeLabel":{"type":"string","maxLength":120},"status":{"enum":["REQUESTED","TODO","IN_PROGRESS","ON_HOLD","COMPLETED","REJECTED","CANCELLED"]},"priority":{"type":["string","null"]},"assigneeRef":{"type":["string","null"]},"createdAt":{"type":"string","format":"date-time"},"dueAt":{"type":["string","null"],"format":"date-time"},"completedAt":{"type":["string","null"],"format":"date-time"},"dueState":{"enum":["NO_DUE","UPCOMING","DUE_SOON","OVERDUE","COMPLETED_ON_TIME","COMPLETED_LATE","CLOSED_UNFINISHED"]},"checklist":{"type":"object","properties":{"completed":{"type":"integer","minimum":0},"total":{"type":"integer","minimum":0}},"required":["completed","total"],"additionalProperties":false},"collaboration":{"type":"object","properties":{"commentCount":{"type":"integer","minimum":0},"unresolvedMentionCount":{"type":"integer","minimum":0},"resourceLinkCount":{"type":"integer","minimum":0}},"required":["commentCount","unresolvedMentionCount","resourceLinkCount"],"additionalProperties":false},"history":{"type":"object","properties":{"lastTransitionCode":{"type":["string","null"]},"holdReasonCategory":{"enum":["NONE","EXTERNAL_FEEDBACK","DEPENDENCY","RESOURCE_SHORTAGE","PRIORITY_CHANGE","OTHER","UNKNOWN"]},"reopenedCount":{"type":"integer","minimum":0}},"required":["lastTransitionCode","holdReasonCategory","reopenedCount"],"additionalProperties":false},"calendarEventRefs":{"type":"array","uniqueItems":true,"items":{"type":"string"}},"signalCodes":{"type":"array","uniqueItems":true,"items":{"enum":["APPROVED_UNASSIGNED","REQUESTED_PENDING","OVERDUE","DUE_SOON","ON_HOLD","CHECKLIST_NOT_STARTED","CHECKLIST_STALLED","RESOURCE_MISSING","UNRESOLVED_MENTION","WORKLOAD_CONCENTRATION","NO_EFFORT_ESTIMATE","NO_COMPLETION_CRITERIA","CALENDAR_CONFLICT","COMPLETED","ON_TIME_COMPLETED"]}},"allowedDecisionOptionCodes":{"type":"array","uniqueItems":true,"items":{"enum":["ASSIGN_OWNER_AND_SET_DUE","DEFINE_HOLD_EXIT_CRITERIA","DEFER_SCOPE","APPROVE_SCOPE","REQUEST_MORE_EVIDENCE","REBALANCE_WORK","KEEP_CURRENT_PLAN"]}},"allowedExecutionStepCodes":{"type":"array","uniqueItems":true,"items":{"enum":["ASSIGN_OWNER","SET_DUE","START_CHECKLIST","LINK_RESOURCE","RESOLVE_MENTION","SET_HOLD_EXIT_CRITERIA","RESUME_TASK","RECORD_SCOPE_DECISION","SET_NEXT_REVIEW_DATE","REBALANCE_ASSIGNEE"]}},"allowedCompletionSignalCodes":{"type":"array","uniqueItems":true,"items":{"enum":["ASSIGNEE_SET","DUE_AT_SET","CHECKLIST_STARTED","RESOURCE_LINKED","MENTION_RESOLVED","HOLD_STATE_RECORDED","TASK_RESUMED","SCOPE_DECISION_RECORDED","NEXT_REVIEW_DATE_SET"]}}},"required":["taskRef","safeLabel","status","priority","assigneeRef","createdAt","dueAt","completedAt","dueState","checklist","collaboration","history","calendarEventRefs","signalCodes","allowedDecisionOptionCodes","allowedExecutionStepCodes","allowedCompletionSignalCodes"],"additionalProperties":false}},"calendarConstraints":{"type":"array","maxItems":30,"items":{"type":"object","properties":{"eventRef":{"type":"string","minLength":1},"type":{"type":"string"},"safeLabel":{"type":"string","maxLength":160},"startAt":{"type":"string","format":"date-time"},"endAt":{"type":"string","format":"date-time"},"relatedTaskRefs":{"type":"array","uniqueItems":true,"items":{"type":"string"}}},"required":["eventRef","type","safeLabel","startAt","endAt","relatedTaskRefs"],"additionalProperties":false}},"riskCandidates":{"type":"array","maxItems":10,"items":{"type":"object","properties":{"candidateRef":{"type":"string","minLength":1},"riskCode":{"type":"string","minLength":1},"severity":{"enum":["HIGH","MEDIUM","LOW"]},"taskRefs":{"type":"array","minItems":1,"uniqueItems":true,"items":{"type":"string"}},"evidenceCodes":{"type":"array","minItems":1,"uniqueItems":true,"items":{"enum":["APPROVED_UNASSIGNED","REQUESTED_PENDING","OVERDUE","DUE_SOON","ON_HOLD","CHECKLIST_NOT_STARTED","CHECKLIST_STALLED","RESOURCE_MISSING","UNRESOLVED_MENTION","WORKLOAD_CONCENTRATION","NO_EFFORT_ESTIMATE","NO_COMPLETION_CRITERIA","CALENDAR_CONFLICT","COMPLETED","ON_TIME_COMPLETED"]}},"allowedOptionCodes":{"type":"array","minItems":1,"uniqueItems":true,"items":{"enum":["ASSIGN_OWNER_AND_SET_DUE","DEFINE_HOLD_EXIT_CRITERIA","DEFER_SCOPE","APPROVE_SCOPE","REQUEST_MORE_EVIDENCE","REBALANCE_WORK","KEEP_CURRENT_PLAN"]}},"allowedExecutionStepCodes":{"type":"array","uniqueItems":true,"items":{"enum":["ASSIGN_OWNER","SET_DUE","START_CHECKLIST","LINK_RESOURCE","RESOLVE_MENTION","SET_HOLD_EXIT_CRITERIA","RESUME_TASK","RECORD_SCOPE_DECISION","SET_NEXT_REVIEW_DATE","REBALANCE_ASSIGNEE"]}},"allowedCompletionSignalCodes":{"type":"array","uniqueItems":true,"items":{"enum":["ASSIGNEE_SET","DUE_AT_SET","CHECKLIST_STARTED","RESOURCE_LINKED","MENTION_RESOLVED","HOLD_STATE_RECORDED","TASK_RESUMED","SCOPE_DECISION_RECORDED","NEXT_REVIEW_DATE_SET"]}}},"required":["candidateRef","riskCode","severity","taskRefs","evidenceCodes","allowedOptionCodes","allowedExecutionStepCodes","allowedCompletionSignalCodes"],"additionalProperties":false}}},"required":["schemaVersion","reportContext","metrics","comparison","workflow","members","tasks","calendarConstraints","riskCandidates"],"additionalProperties":false}