{
  "schemaVersion": "ai-weekly-report-snapshot.v1",
  "reportContext": {
    "groupRef": "GROUP-7",
    "period": {
      "from": "2026-07-20",
      "toExclusive": "2026-07-27",
      "timezone": "Asia/Seoul"
    },
    "generatedAt": "2026-07-27T00:05:00Z",
    "language": "KO",
    "promptVersion": "v7-2-prompt-001"
  },
  "metrics": {
    "periodTaskCount": 12,
    "completionRatePercent": 42,
    "onTimeRatePercent": 75,
    "delayedCount": 2,
    "averageCompletionHours": 34
  },
  "comparison": {
    "status": "AVAILABLE",
    "previousFrom": "2026-07-13",
    "previousToExclusive": "2026-07-20",
    "periodTaskCountDelta": 2,
    "completionRatePointDelta": -8,
    "onTimeRatePointDelta": -8,
    "delayedCountDelta": 1
  },
  "workflow": {
    "requested": 2,
    "acceptedUnassigned": 1,
    "assignedNotStarted": 1,
    "inProgress": 2,
    "onHold": 1,
    "completed": 5
  },
  "members": [
    {
      "memberRef": "MEMBER-1",
      "role": "LEADER",
      "assignedCount": 3,
      "activeCount": 1,
      "completedCount": 2,
      "delayedCount": 0,
      "onTimeRatePercent": 100,
      "upcomingCalendarCount": 1
    },
    {
      "memberRef": "MEMBER-3",
      "role": "MEMBER",
      "assignedCount": 4,
      "activeCount": 3,
      "completedCount": 1,
      "delayedCount": 1,
      "onTimeRatePercent": 50,
      "upcomingCalendarCount": 0
    }
  ],
  "tasks": [
    {
      "taskRef": "TASK-101",
      "safeLabel": "체크리스트까지 완료된 기한 준수 업무",
      "status": "COMPLETED",
      "priority": "HIGH",
      "assigneeRef": "MEMBER-1",
      "createdAt": "2026-07-20T09:00:00+09:00",
      "dueAt": "2026-07-24T18:00:00+09:00",
      "completedAt": "2026-07-23T15:20:00+09:00",
      "dueState": "COMPLETED_ON_TIME",
      "checklist": {
        "completed": 4,
        "total": 4
      },
      "collaboration": {
        "commentCount": 3,
        "unresolvedMentionCount": 0,
        "resourceLinkCount": 2
      },
      "history": {
        "lastTransitionCode": "IN_PROGRESS_TO_COMPLETED",
        "holdReasonCategory": "NONE",
        "reopenedCount": 0
      },
      "calendarEventRefs": [],
      "signalCodes": [
        "COMPLETED",
        "ON_TIME_COMPLETED"
      ],
      "allowedDecisionOptionCodes": [
        "KEEP_CURRENT_PLAN"
      ],
      "allowedExecutionStepCodes": [],
      "allowedCompletionSignalCodes": []
    },
    {
      "taskRef": "TASK-104",
      "safeLabel": "승인 후 담당자가 없는 지연 업무",
      "status": "TODO",
      "priority": "HIGH",
      "assigneeRef": null,
      "createdAt": "2026-07-21T10:00:00+09:00",
      "dueAt": "2026-07-25T18:00:00+09:00",
      "completedAt": null,
      "dueState": "OVERDUE",
      "checklist": {
        "completed": 0,
        "total": 5
      },
      "collaboration": {
        "commentCount": 2,
        "unresolvedMentionCount": 1,
        "resourceLinkCount": 0
      },
      "history": {
        "lastTransitionCode": "REQUESTED_TO_TODO",
        "holdReasonCategory": "NONE",
        "reopenedCount": 0
      },
      "calendarEventRefs": [
        "EVENT-14"
      ],
      "signalCodes": [
        "APPROVED_UNASSIGNED",
        "OVERDUE",
        "CHECKLIST_NOT_STARTED",
        "UNRESOLVED_MENTION"
      ],
      "allowedDecisionOptionCodes": [
        "ASSIGN_OWNER_AND_SET_DUE",
        "DEFER_SCOPE"
      ],
      "allowedExecutionStepCodes": [
        "ASSIGN_OWNER",
        "SET_DUE",
        "START_CHECKLIST",
        "RESOLVE_MENTION"
      ],
      "allowedCompletionSignalCodes": [
        "ASSIGNEE_SET",
        "DUE_AT_SET",
        "CHECKLIST_STARTED",
        "MENTION_RESOLVED"
      ]
    },
    {
      "taskRef": "TASK-110",
      "safeLabel": "외부 의존성으로 보류 중인 준비 업무",
      "status": "ON_HOLD",
      "priority": null,
      "assigneeRef": "MEMBER-3",
      "createdAt": "2026-07-14T11:00:00+09:00",
      "dueAt": "2026-07-31T18:00:00+09:00",
      "completedAt": null,
      "dueState": "DUE_SOON",
      "checklist": {
        "completed": 1,
        "total": 6
      },
      "collaboration": {
        "commentCount": 5,
        "unresolvedMentionCount": 0,
        "resourceLinkCount": 1
      },
      "history": {
        "lastTransitionCode": "IN_PROGRESS_TO_ON_HOLD",
        "holdReasonCategory": "EXTERNAL_FEEDBACK",
        "reopenedCount": 1
      },
      "calendarEventRefs": [
        "EVENT-14"
      ],
      "signalCodes": [
        "ON_HOLD",
        "DUE_SOON",
        "CHECKLIST_STALLED"
      ],
      "allowedDecisionOptionCodes": [
        "DEFINE_HOLD_EXIT_CRITERIA",
        "REQUEST_MORE_EVIDENCE"
      ],
      "allowedExecutionStepCodes": [
        "SET_HOLD_EXIT_CRITERIA",
        "RESUME_TASK",
        "SET_NEXT_REVIEW_DATE"
      ],
      "allowedCompletionSignalCodes": [
        "HOLD_STATE_RECORDED",
        "TASK_RESUMED",
        "NEXT_REVIEW_DATE_SET"
      ]
    }
  ],
  "calendarConstraints": [
    {
      "eventRef": "EVENT-14",
      "type": "MEETING",
      "safeLabel": "팀 전체가 참여하는 확정 회의",
      "startAt": "2026-07-31T14:00:00+09:00",
      "endAt": "2026-07-31T16:00:00+09:00",
      "relatedTaskRefs": [
        "TASK-104",
        "TASK-110"
      ]
    }
  ],
  "riskCandidates": [
    {
      "candidateRef": "RISK-001",
      "riskCode": "APPROVED_UNASSIGNED_OVERDUE",
      "severity": "HIGH",
      "taskRefs": [
        "TASK-104"
      ],
      "evidenceCodes": [
        "APPROVED_UNASSIGNED",
        "OVERDUE",
        "CHECKLIST_NOT_STARTED"
      ],
      "allowedOptionCodes": [
        "ASSIGN_OWNER_AND_SET_DUE",
        "DEFER_SCOPE"
      ],
      "allowedExecutionStepCodes": [
        "ASSIGN_OWNER",
        "SET_DUE",
        "START_CHECKLIST"
      ],
      "allowedCompletionSignalCodes": [
        "ASSIGNEE_SET",
        "DUE_AT_SET",
        "CHECKLIST_STARTED"
      ]
    },
    {
      "candidateRef": "RISK-002",
      "riskCode": "ON_HOLD_LONG",
      "severity": "MEDIUM",
      "taskRefs": [
        "TASK-110"
      ],
      "evidenceCodes": [
        "ON_HOLD",
        "CHECKLIST_STALLED"
      ],
      "allowedOptionCodes": [
        "DEFINE_HOLD_EXIT_CRITERIA"
      ],
      "allowedExecutionStepCodes": [
        "SET_HOLD_EXIT_CRITERIA",
        "SET_NEXT_REVIEW_DATE"
      ],
      "allowedCompletionSignalCodes": [
        "HOLD_STATE_RECORDED",
        "NEXT_REVIEW_DATE_SET"
      ]
    },
    {
      "candidateRef": "RISK-003",
      "riskCode": "UNRESOLVED_MENTION",
      "severity": "LOW",
      "taskRefs": [
        "TASK-104"
      ],
      "evidenceCodes": [
        "UNRESOLVED_MENTION"
      ],
      "allowedOptionCodes": [
        "REQUEST_MORE_EVIDENCE"
      ],
      "allowedExecutionStepCodes": [
        "RESOLVE_MENTION"
      ],
      "allowedCompletionSignalCodes": [
        "MENTION_RESOLVED"
      ]
    }
  ]
}
